{
  "$schema": "https://json-schema.org/draft/2020-12/schema",
  "title": "AlphaFold 3 Input",
  "type": "object",
  "required": ["name", "sequences", "modelSeeds", "dialect", "version"],
  "properties": {
    "name": {
      "type": "string",
      "minLength": 1
    },
    "sequences": {
      "type": "array",
      "minItems": 1,
      "items": {
        "type": "object",
        "oneOf": [
          {
            "required": ["protein"],
            "properties": {
              "protein": { "$ref": "#/$defs/proteinChain" }
            },
            "additionalProperties": false
          },
          {
            "required": ["dna"],
            "properties": {
              "dna": { "$ref": "#/$defs/nucleotideChain" }
            },
            "additionalProperties": false
          },
          {
            "required": ["rna"],
            "properties": {
              "rna": { "$ref": "#/$defs/nucleotideChain" }
            },
            "additionalProperties": false
          },
          {
            "required": ["ligand"],
            "properties": {
              "ligand": { "$ref": "#/$defs/ligandChain" }
            },
            "additionalProperties": false
          }
        ]
      }
    },
    "modelSeeds": {
      "type": "array",
      "minItems": 1,
      "items": { "type": "integer" }
    },
    "dialect": {
      "type": "string",
      "const": "alphafold3"
    },
    "version": {
      "type": "integer"
    },
    "bondedAtomPairs": {
      "type": "array",
      "items": {
        "type": "array",
        "items": {
          "type": "array",
          "prefixItems": [
            { "type": "string" },
            { "type": "integer" },
            { "type": "string" }
          ],
          "minItems": 3,
          "maxItems": 3
        },
        "minItems": 2,
        "maxItems": 2
      }
    }
  },
  "additionalProperties": false,
  "$defs": {
    "chainId": {
      "oneOf": [
        { "type": "string", "minLength": 1 },
        { "type": "array", "items": { "type": "string", "minLength": 1 }, "minItems": 1 }
      ]
    },
    "modification": {
      "type": "object",
      "required": ["ptmType", "ptmPosition"],
      "properties": {
        "ptmType": { "type": "string" },
        "ptmPosition": { "type": "integer", "minimum": 1 }
      },
      "additionalProperties": false
    },
    "proteinChain": {
      "type": "object",
      "required": ["id", "sequence"],
      "properties": {
        "id": { "$ref": "#/$defs/chainId" },
        "sequence": { "type": "string", "pattern": "^[A-Z]+$" },
        "modifications": {
          "type": "array",
          "items": { "$ref": "#/$defs/modification" }
        }
      },
      "additionalProperties": false
    },
    "nucleotideChain": {
      "type": "object",
      "required": ["id", "sequence"],
      "properties": {
        "id": { "$ref": "#/$defs/chainId" },
        "sequence": { "type": "string", "minLength": 1 },
        "modifications": {
          "type": "array",
          "items": { "$ref": "#/$defs/modification" }
        }
      },
      "additionalProperties": false
    },
    "ligandChain": {
      "type": "object",
      "required": ["id"],
      "properties": {
        "id": { "$ref": "#/$defs/chainId" },
        "ccdCodes": {
          "type": "array",
          "items": { "type": "string" },
          "minItems": 1
        },
        "smiles": { "type": "string" }
      },
      "additionalProperties": false
    }
  }
}
